{
  "type": "profile-header",
  "version": 1,
  "description": "User avatar and display name.",
  "props": {
    "type": "object",
    "required": ["displayName", "avatarUrl"],
    "properties": {
      "displayName": { "type": "string" },
      "avatarUrl": { "type": "string", "format": "uri" }
    }
  }
}
