{
  "type": "follow-button",
  "version": 1,
  "description": "Follow/unfollow toggle. The client calls the follow API itself; the composer only supplies initial state.",
  "props": {
    "type": "object",
    "required": [
      "userId",
      "isFollowing"
    ],
    "properties": {
      "userId": {
        "type": "string"
      },
      "isFollowing": {
        "type": "boolean"
      },
      "displayName": {
        "type": "string",
        "description": "Who the button follows, for its label. Added in v1 as optional, so older apps ignore it."
      }
    }
  }
}
